{
  "id": "lena-hoffmann",
  "names": {
    "display": "Lena Hoffmann"
  },
  "pronouns": [
    "she/her"
  ],
  "birth": {
    "date": "1993-07-30",
    "place": "Stuttgart"
  },
  "status": "living",
  "parents": [
    {
      "id": "agnes-vogt",
      "kind": "birth"
    },
    {
      "id": "peter-hoffmann",
      "kind": "birth"
    }
  ],
  "meta": {
    "created": "2026-07-26",
    "updated": "2026-07-26",
    "author": "agent"
  }
}
