{
  "id": "mira-okafor",
  "names": {
    "display": "Mira Okafor"
  },
  "pronouns": [
    "she/her"
  ],
  "birth": {
    "date": "1970",
    "place": null
  },
  "status": "living",
  "parents": [],
  "meta": {
    "created": "2026-07-26",
    "updated": "2026-07-26",
    "author": "agent"
  }
}
