{
  "id": "noor-vogt",
  "names": {
    "display": "Noor Vogt"
  },
  "pronouns": [
    "they/them"
  ],
  "birth": {
    "date": "2001-11-20",
    "place": null
  },
  "status": "living",
  "parents": [
    {
      "id": "theo-vogt",
      "kind": "birth"
    },
    {
      "id": "mira-okafor",
      "kind": "birth"
    },
    {
      "id": "ida-lindqvist",
      "kind": "guardian",
      "confidence": "certain"
    }
  ],
  "meta": {
    "created": "2026-07-26",
    "updated": "2026-07-26",
    "author": "agent"
  }
}
